<?xml version="1.0" ?>
<!--
/**
 * KiwiCommerce
 *
 * Do not edit or add to this file if you wish to upgrade to newer versions in the future.
 * If you wish to customize this module for your needs.
 * Please contact us https://kiwicommerce.co.uk/contacts.
 *
 * @category   KiwiCommerce
 * @package    KiwiCommerce_AdminActivity
 * @copyright  Copyright (C) 2018 Kiwi Commerce Ltd (https://kiwicommerce.co.uk/)
 * @license    https://kiwicommerce.co.uk/magento2-extension-license/
 */
-->
<config xmlns:xsi="http://www.w3.org/2001/XMLSchema-instance" xsi:noNamespaceSchemaLocation="adminactivity.xsd">
    <actions>
        <action id="view">
            <label translate="true">View</label>
        </action>
        <action id="save">
            <label translate="true">New</label>
        </action>
        <action id="edit">
            <label translate="true">Edit</label>
        </action>
        <action id="delete">
            <label translate="true">Delete</label>
        </action>
        <action id="massDelete">
            <label translate="true">Mass Delete</label>
        </action>
        <action id="massStatus">
            <label translate="true">Mass Status</label>
        </action>
        <action id="massEdit">
            <label translate="true">Mass Edit</label>
        </action>
        <action id="massSubscribe">
            <label translate="true">Mass Subscribe</label>
        </action>
        <action id="massUnsubscribe">
            <label translate="true">Mass Unsubscribe</label>
        </action>
        <action id="massAssignGroup">
            <label translate="true">Mass Assign Group</label>
        </action>
        <action id="massDisable">
            <label translate="true">Mass Disable</label>
        </action>
        <action id="massEnable">
            <label translate="true">Mass Enable</label>
        </action>
        <action id="reorder">
            <label translate="true">Reorder</label>
        </action>
        <action id="hold">
            <label translate="true">Hold</label>
        </action>
        <action id="unhold">
            <label translate="true">Unhold</label>
        </action>
        <action id="cancel">
            <label translate="true">Cancel</label>
        </action>
        <action id="addComment">
            <label translate="true">Add Comment</label>
        </action>
        <action id="massCancel">
            <label translate="true">Mass Cancel</label>
        </action>
        <action id="massHold">
            <label translate="true">Mass Hold</label>
        </action>
        <action id="massUnhold">
            <label translate="true">Mass Unhold</label>
        </action>
        <action id="assign">
            <label translate="true">Assign</label>
        </action>
        <action id="unassign">
            <label translate="true">Unassign</label>
        </action>
    </actions>
    <modules>
        <module name="catalog_products">
            <label translate="true">Catalog Product</label>
            <models>
                <class name="Magento\Catalog\Model\Product" />
                <class name="Magento\Catalog\Model\Product\Action" />
                <class name="Magento\Catalog\Model\Product\Attribute\Source\Status" />
                <class name="Magento\CatalogInventory\Model\StockState" />
            </models>
            <events>
                <event controller_action="catalog_product_save" action_alias="save" />
                <event controller_action="catalog_product_massDelete" action_alias="massDelete" />
                <event controller_action="catalog_product_massStatus" action_alias="massStatus" post_dispatch="productUpdate" />
                <event controller_action="catalog_product_action_attribute_save" action_alias="massEdit" post_dispatch="productUpdate" />
            </events>
            <config>
                <trackfield method="getProductFieldData" />
                <configpath constant="MODULE_PRODUCT" />
                <editurl url="{{module}}/{{controller}}/edit/id/{{id}}" />
                <itemfield field="name" />
            </config>
        </module>
        <module name="catalog_categories">
            <label translate="true">Catalog Categories</label>
            <models>
                <class name="Magento\Catalog\Model\Category" />
            </models>
            <events>
                <event controller_action="catalog_category_save" action_alias="save" />
                <event controller_action="catalog_category_edit" action_alias="edit" />
                <event controller_action="catalog_category_delete" action_alias="delete" />
            </events>
            <config>
                <trackfield method="getCategoryFieldData" />
                <configpath constant="MODULE_CATEGORY" />
                <editurl url="{{module}}/{{controller}}/edit/id/{{id}}" />
                <itemfield field="name" />
            </config>
        </module>
        <module name="customer">
            <label translate="true">Customer</label>
            <models>
                <class name="Magento\Customer\Model\Customer" />
                <class name="Magento\Newsletter\Model\Subscriber" />
                <class name="Magento\Customer\Model\Address" />
            </models>
            <events>
                <event controller_action="customer_index_save" action_alias="save" />
                <event controller_action="customer_index_delete" action_alias="delete" />
                <event controller_action="customer_index_massDelete" action_alias="massDelete" />
                <event controller_action="customer_index_massSubscribe" action_alias="massSubscribe" />
                <event controller_action="customer_index_massUnsubscribe" action_alias="massUnsubscribe" />
                <event controller_action="customer_index_massAssignGroup" action_alias="massAssignGroup" />
                <event controller_action="customer_index_inlineEdit" action_alias="massEdit" />
            </events>
            <config>
                <trackfield method="getCustomerFieldData" />
                <configpath constant="MODULE_CUSTOMER" />
                <editurl url="{{module}}/{{controller}}/edit/id/{{id}}" />
                <itemfield field="firstname" />
            </config>
        </module>
        <module name="customer_group">
            <label translate="true">Customer Group</label>
            <models>
                <class name="Magento\Customer\Model\Group" />
            </models>
            <events>
                <event controller_action="customer_group_save" action_alias="save" />
                <event controller_action="customer_group_delete" action_alias="delete" />
            </events>
            <config>
                <trackfield method="getCustomerGroupFieldData" />
                <configpath constant="MODULE_CUSTOMER" />
                <editurl url="{{module}}/{{controller}}/edit/id/{{id}}" />
                <itemfield field="customer_group_code" />
            </config>
        </module>
        <module name="catalog_promotion">
            <label translate="true">Catalog Promotion</label>
            <models>
                <class name="Magento\CatalogRule\Model\Rule" />
            </models>
            <events>
                <event controller_action="catalog_rule_promo_catalog_save" action_alias="save" />
                <event controller_action="catalog_rule_promo_catalog_edit" action_alias="edit" />
                <event controller_action="catalog_rule_promo_catalog_delete" action_alias="delete" />
            </events>
            <config>
                <trackfield method="getCatalogPromotionFieldData" />
                <configpath constant="MODULE_PROMOTION" />
                <editurl url="{{module}}/{{controller}}/edit/id/{{id}}" />
                <itemfield field="name" />
            </config>
        </module>
        <module name="cart_promotion">
            <label translate="true">Cart Promotion</label>
            <models>
                <class name="Magento\SalesRule\Model\Rule" />
            </models>
            <events>
                <event controller_action="sales_rule_promo_quote_save" action_alias="save" />
                <event controller_action="sales_rule_promo_quote_edit" action_alias="edit" />
                <event controller_action="sales_rule_promo_quote_delete" action_alias="delete" />
            </events>
            <config>
                <trackfield method="getCartPromotionFieldData" />
                <configpath constant="MODULE_PROMOTION" />
                <editurl url="{{module}}/{{controller}}/edit/id/{{id}}" />
                <itemfield field="name" />
            </config>
        </module>
        <module name="email">
            <label translate="true">Email Newsletter</label>
            <models>
                <class name="Magento\Email\Model\Template" />
                <class name="Magento\Newsletter\Model\Template" />
            </models>
            <events>
                <event controller_action="adminhtml_email_template_save" action_alias="save" />
                <event controller_action="adminhtml_email_template_edit" action_alias="edit" />
                <event controller_action="adminhtml_email_template_delete" action_alias="delete" />
                <event controller_action="newsletter_template_save" action_alias="save" />
                <event controller_action="newsletter_template_delete" action_alias="delete" />
            </events>
            <config>
                <trackfield method="getEmailFieldData" />
                <configpath constant="MODULE_EMAIL" />
                <editurl url="{{module}}/{{controller}}/edit/id/{{id}}" />
                <itemfield field="template_subject" />
            </config>
        </module>
        <module name="cms_pages">
            <label translate="true">Cms Pages</label>
            <models>